<?xml version="1.0" encoding="UTF-8"?>

<!ELEMENT uczelnia (nazwa, wydzial+)>
<!ELEMENT nazwa (#PCDATA)>

<!ELEMENT wydzial (#PCDATA | kierunek | instytut)*>
<!ELEMENT kierunek (#PCDATA)>
<!ELEMENT instytut (#PCDATA)>
